[
  {
    "id": "fx",
    "name": "fx",
    "description": "Terminal JSON viewer and processor. Interactive navigation with fuzzy search, JavaScript expressions for transforming data, and streaming support.",
    "url": "https://fx.wtf",
    "category": "Data Analysis",
    "os": ["windows", "macos", "linux"],
    "pricing": "free",
    "tags": ["json", "cli", "tui", "data-viewer", "open-source"],
    "source": "https://github.com/antonmedv/fx",
    "language": "go"
  },
  {
    "id": "dasel",
    "name": "dasel",
    "description": "Query, modify, and convert data in JSON, YAML, TOML, XML, CSV, and INI with a single tool. Zero runtime dependencies.",
    "url": "https://daseldocs.tomwright.me",
    "category": "Data Analysis",
    "os": ["windows", "macos", "linux"],
    "pricing": "free",
    "tags": ["json", "yaml", "toml", "xml", "cli", "open-source"],
    "source": "https://github.com/TomWright/dasel",
    "language": "go"
  },
  {
    "id": "xsv",
    "name": "xsv",
    "description": "Fast CSV command-line toolkit written in Rust. Indexing, slicing, searching, joining, and statistics on large CSV files.",
    "url": "https://github.com/BurntSushi/xsv",
    "category": "Data Analysis",
    "os": ["windows", "macos", "linux"],
    "pricing": "free",
    "tags": ["csv", "rust", "cli", "fast", "open-source"],
    "source": "https://github.com/BurntSushi/xsv",
    "language": "rust"
  },
  {
    "id": "q-text-as-data",
    "name": "q",
    "description": "Run SQL directly on CSV, TSV, and other delimited files. Auto-detects column types and supports JOINs, GROUP BY, and caching.",
    "url": "https://harelba.github.io/q",
    "category": "Data Analysis",
    "os": ["windows", "macos", "linux"],
    "pricing": "free",
    "tags": ["sql", "csv", "cli", "data-query", "open-source"],
    "source": "https://github.com/harelba/q",
    "language": "python"
  },
  {
    "id": "visidata",
    "name": "VisiData",
    "description": "Terminal spreadsheet multitool for exploring tabular data. Handles CSV, JSON, SQLite, Excel, and many formats with vim-like keybindings.",
    "url": "https://www.visidata.org",
    "category": "Data Analysis",
    "os": ["windows", "macos", "linux"],
    "pricing": "free",
    "tags": ["tui", "spreadsheet", "csv", "data-exploration", "open-source"],
    "source": "https://github.com/saulpw/visidata",
    "language": "python"
  },
  {
    "id": "diff-so-fancy",
    "name": "diff-so-fancy",
    "description": "Makes git diffs human-readable. Removes +/- clutter, simplifies headers, and highlights word-level changes for faster code review.",
    "url": "https://github.com/so-fancy/diff-so-fancy",
    "category": "Version Control",
    "os": ["windows", "macos", "linux"],
    "pricing": "free",
    "tags": ["git", "diff", "cli", "code-review", "open-source"],
    "source": "https://github.com/so-fancy/diff-so-fancy",
    "language": "perl"
  },
  {
    "id": "delta",
    "name": "delta",
    "description": "Syntax-highlighting pager for git, diff, grep, and blame output. Side-by-side view, line numbers, and bat-compatible themes.",
    "url": "https://github.com/dandavison/delta",
    "category": "Version Control",
    "os": ["windows", "macos", "linux"],
    "pricing": "free",
    "tags": ["git", "diff", "syntax-highlighting", "rust", "open-source"],
    "source": "https://github.com/dandavison/delta",
    "language": "rust"
  },
  {
    "id": "mkcert",
    "name": "mkcert",
    "description": "Zero-config tool to create locally-trusted development certificates. Installs a local CA in the system trust store automatically.",
    "url": "https://github.com/FiloSottile/mkcert",
    "category": "Networking",
    "os": ["windows", "macos", "linux"],
    "pricing": "free",
    "tags": ["tls", "certificates", "localhost", "development", "open-source"],
    "source": "https://github.com/FiloSottile/mkcert",
    "language": "go"
  }
]
