[
  {
    "id": "opencode",
    "name": "OpenCode",
    "description": "Open-source, provider-agnostic AI coding agent for the terminal. Go-based TUI, 75+ LLM providers, LSP integration, session management.",
    "url": "https://opencode.ai",
    "category": "Harnesses",
    "os": ["windows", "macos", "linux"],
    "pricing": "free",
    "tags": ["ai", "coding-agent", "cli", "tui", "llm", "open-source", "provider-agnostic"],
    "source": "https://github.com/opencode-ai/opencode"
  },
  {
    "id": "junie-cli",
    "name": "Junie CLI",
    "description": "JetBrains' LLM-agnostic terminal coding agent. BYOK model, MCP integration, custom agents/skills, one-click migration from Claude Code.",
    "url": "https://www.jetbrains.com/junie/",
    "category": "Harnesses",
    "os": ["windows", "macos", "linux"],
    "pricing": "free",
    "tags": ["ai", "coding-agent", "cli", "jetbrains", "llm-agnostic", "byok", "mcp"],
    "source": "https://github.com/JetBrains/junie"
  },
  {
    "id": "gemini-cli",
    "name": "Gemini CLI",
    "description": "Google's open-source AI agent bringing Gemini models to the terminal. ReAct loop, MCP servers, free tier with Gemini 2.5 Pro.",
    "url": "https://github.com/google-gemini/gemini-cli",
    "category": "Harnesses",
    "os": ["windows", "macos", "linux"],
    "pricing": "free",
    "tags": ["ai", "coding-agent", "cli", "google", "gemini", "open-source", "mcp"],
    "source": "https://github.com/google-gemini/gemini-cli"
  },
  {
    "id": "kilo-code-cli",
    "name": "Kilo Code CLI",
    "description": "AI coding agent with built-in sub-agent orchestration. Code, Plan, and Debug agents auto-delegate without a separate orchestrator.",
    "url": "https://kilo.ai",
    "category": "Harnesses",
    "os": ["windows", "macos", "linux"],
    "pricing": "free",
    "tags": ["ai", "coding-agent", "cli", "multi-agent", "orchestration", "open-source"]
  },
  {
    "id": "cmux",
    "name": "cmux",
    "description": "Terminal built for running multiple AI agents simultaneously. Vertical tabs with git branch status, notification rings, split panes, Unix socket API.",
    "url": "https://cmux.com",
    "category": "Terminal Emulators",
    "os": ["macos"],
    "pricing": "paid",
    "tags": ["terminal", "ai", "multiplexer", "agent-workflow", "macos"]
  },
  {
    "id": "ghostty",
    "name": "Ghostty",
    "description": "Fast, GPU-accelerated, cross-platform terminal emulator with platform-native UI. Written in Zig. Non-profit backed.",
    "url": "https://ghostty.org",
    "category": "Terminal Emulators",
    "os": ["macos", "linux"],
    "pricing": "free",
    "tags": ["terminal", "gpu", "zig", "open-source", "cross-platform"]
  },
  {
    "id": "termdock",
    "name": "Termdock",
    "description": "Terminal-centric AI dev environment unifying multi-workspace management, terminal layouts, Git visualization, and AST search via Tree-sitter.",
    "url": "https://www.termdock.com",
    "category": "Terminal Emulators",
    "os": ["macos", "linux"],
    "pricing": "paid",
    "tags": ["terminal", "ai", "workspace", "git", "tree-sitter"]
  },
  {
    "id": "octrafic",
    "name": "Octrafic",
    "description": "CLI for natural-language API testing. Describe tests in English, runs against OpenAPI specs, Swagger, GraphQL, or live endpoints. Single Go binary.",
    "url": "https://github.com/octrafic/octrafic-cli",
    "category": "Testing Frameworks",
    "os": ["windows", "macos", "linux"],
    "pricing": "free",
    "tags": ["api", "testing", "natural-language", "openapi", "graphql", "cli", "open-source"],
    "source": "https://github.com/octrafic/octrafic-cli"
  },
  {
    "id": "clanker-cli",
    "name": "Clanker CLI",
    "description": "Autonomous DevOps agent for querying infrastructure across AWS, GCP, Azure, and Kubernetes in natural language. Read-only by default.",
    "url": "https://github.com/bgdnvk/clanker",
    "category": "Cloud SDKs & CLIs",
    "os": ["windows", "macos", "linux"],
    "pricing": "free",
    "tags": ["devops", "infrastructure", "ai", "multi-cloud", "kubernetes", "natural-language", "cli"],
    "source": "https://github.com/bgdnvk/clanker"
  },
  {
    "id": "ty",
    "name": "ty",
    "description": "Extremely fast Python type checker and language server written in Rust by Astral. 10-100x faster than mypy/Pyright. Intersection types, Jupyter support.",
    "url": "https://github.com/astral-sh/ty",
    "category": "Code Coverage & Quality",
    "os": ["windows", "macos", "linux"],
    "pricing": "free",
    "tags": ["python", "type-checking", "rust", "language-server", "astral", "open-source"],
    "source": "https://github.com/astral-sh/ty"
  },
  {
    "id": "uv",
    "name": "uv",
    "description": "Extremely fast Python package and project manager in Rust. Replaces pip, pip-tools, pipenv, poetry, and pyenv in a single tool.",
    "url": "https://astral.sh",
    "category": "Package Managers",
    "os": ["windows", "macos", "linux"],
    "pricing": "free",
    "tags": ["python", "package-manager", "rust", "astral", "fast", "open-source"],
    "source": "https://github.com/astral-sh/uv"
  },
  {
    "id": "devbox",
    "name": "Devbox",
    "description": "Create isolated, reproducible dev environments using Nix packages without learning Nix. Declare tools in devbox.json, run devbox shell.",
    "url": "https://www.jetify.com/devbox",
    "category": "Shell Environments",
    "os": ["macos", "linux"],
    "pricing": "free",
    "tags": ["nix", "dev-environment", "reproducible", "isolated", "cli", "open-source"],
    "source": "https://github.com/jetify-com/devbox"
  },
  {
    "id": "prowler",
    "name": "Prowler",
    "description": "CLI for cloud security assessments across AWS, Azure, and GCP. Checks against CIS, GDPR, HIPAA compliance standards.",
    "url": "https://prowler.com",
    "category": "Security Scanning",
    "os": ["windows", "macos", "linux"],
    "pricing": "free",
    "tags": ["security", "cloud", "compliance", "aws", "azure", "gcp", "cli", "open-source"],
    "source": "https://github.com/prowler-cloud/prowler"
  }
]
