[
  {
    "id": "opentelemetry",
    "name": "OpenTelemetry",
    "description": "Vendor-neutral observability framework for cloud-native software. APIs, SDKs, and tools for traces, metrics, and logs.",
    "url": "https://opentelemetry.io",
    "category": "Monitoring & Metrics",
    "os": [
      "windows",
      "macos",
      "linux"
    ],
    "pricing": "free",
    "tags": [
      "observability",
      "tracing",
      "metrics",
      "cncf",
      "open-source"
    ],
    "source": "https://github.com/open-telemetry/opentelemetry-specification"
  },
  {
    "id": "jaeger",
    "name": "Jaeger",
    "description": "Open-source distributed tracing platform. Monitor and troubleshoot request flows across microservices.",
    "url": "https://www.jaegertracing.io",
    "category": "Monitoring & Metrics",
    "os": [
      "windows",
      "macos",
      "linux"
    ],
    "pricing": "free",
    "tags": [
      "distributed-tracing",
      "microservices",
      "cncf",
      "open-source"
    ],
    "source": "https://github.com/jaegertracing/jaeger",
    "language": "go"
  },
  {
    "id": "zipkin",
    "name": "Zipkin",
    "description": "Distributed tracing system for gathering timing data across services. Helps troubleshoot latency problems in service architectures.",
    "url": "https://zipkin.io",
    "category": "Monitoring & Metrics",
    "os": [
      "windows",
      "macos",
      "linux"
    ],
    "pricing": "free",
    "tags": [
      "distributed-tracing",
      "latency",
      "microservices",
      "open-source"
    ],
    "source": "https://github.com/openzipkin/zipkin",
    "language": "java"
  },
  {
    "id": "victoriametrics",
    "name": "VictoriaMetrics",
    "description": "Fast, cost-effective time series database and monitoring solution. Drop-in Prometheus replacement with better compression.",
    "url": "https://victoriametrics.com",
    "category": "Monitoring & Metrics",
    "os": [
      "windows",
      "macos",
      "linux"
    ],
    "pricing": "freemium",
    "tags": [
      "time-series",
      "metrics",
      "prometheus-compatible",
      "open-source"
    ],
    "source": "https://github.com/VictoriaMetrics/VictoriaMetrics",
    "language": "go"
  },
  {
    "id": "thanos",
    "name": "Thanos",
    "description": "Highly available Prometheus setup with long-term storage. Downsampling, compaction, and global query view across clusters.",
    "url": "https://thanos.io",
    "category": "Monitoring & Metrics",
    "os": [
      "windows",
      "macos",
      "linux"
    ],
    "pricing": "free",
    "tags": [
      "prometheus",
      "long-term-storage",
      "high-availability",
      "cncf",
      "open-source"
    ],
    "source": "https://github.com/thanos-io/thanos",
    "language": "go"
  },
  {
    "id": "gatus",
    "name": "Gatus",
    "description": "Developer-oriented status page with automated health checks. Monitors HTTP, DNS, TCP, and ICMP endpoints with alerting.",
    "url": "https://gatus.io",
    "category": "Monitoring & Metrics",
    "os": [
      "windows",
      "macos",
      "linux"
    ],
    "pricing": "free",
    "tags": [
      "status-page",
      "health-checks",
      "uptime",
      "self-hosted",
      "open-source"
    ],
    "source": "https://github.com/TwiN/gatus",
    "language": "go"
  },
  {
    "id": "checkly",
    "name": "Checkly",
    "description": "Monitoring as code for APIs and browser checks. Define checks in JavaScript/TypeScript alongside your application code.",
    "url": "https://www.checklyhq.com",
    "category": "Monitoring & Metrics",
    "os": [
      "web"
    ],
    "pricing": "freemium",
    "tags": [
      "monitoring-as-code",
      "api-monitoring",
      "synthetic-monitoring",
      "saas"
    ],
    "source": "https://github.com/checkly/checkly-cli"
  }
]
