[
  {
    "id": "qgis",
    "name": "QGIS",
    "description": "Full-featured open-source desktop GIS. Create, edit, visualize, and analyze geospatial data with extensive plugin ecosystem.",
    "url": "https://qgis.org",
    "category": "GIS & Mapping",
    "os": ["windows", "macos", "linux"],
    "pricing": "free",
    "tags": ["gis", "desktop", "open-source", "osgeo", "spatial-analysis"],
    "source": "https://github.com/qgis/QGIS",
    "language": "cpp"
  },
  {
    "id": "grass-gis",
    "name": "GRASS GIS",
    "description": "Geospatial processing engine for raster, vector, and temporal data. 400+ modules for terrain modeling, hydrology, and imagery.",
    "url": "https://grass.osgeo.org",
    "category": "GIS & Mapping",
    "os": ["windows", "macos", "linux"],
    "pricing": "free",
    "tags": ["gis", "raster", "vector", "open-source", "osgeo"],
    "source": "https://github.com/OSGeo/grass",
    "language": "c"
  },
  {
    "id": "google-earth-pro",
    "name": "Google Earth Pro",
    "description": "3D earth visualization with historical imagery, GIS data import/export, and measurement tools. Free for desktop use.",
    "url": "https://www.google.com/earth/about/versions",
    "category": "GIS & Mapping",
    "os": ["windows", "macos", "linux"],
    "pricing": "free",
    "tags": ["3d-globe", "satellite-imagery", "gis", "google", "visualization"]
  },
  {
    "id": "gdal",
    "name": "GDAL/OGR",
    "description": "Translator library for 200+ raster and vector geospatial data formats. The backbone of most open-source GIS software.",
    "url": "https://gdal.org",
    "category": "GIS & Mapping",
    "os": ["windows", "macos", "linux"],
    "pricing": "free",
    "tags": ["geospatial", "data-formats", "raster", "vector", "open-source"],
    "source": "https://github.com/OSGeo/gdal",
    "language": "cpp"
  },
  {
    "id": "proj",
    "name": "PROJ",
    "description": "Coordinate transformation library for cartographic projections and geodetic computations. Core dependency for most GIS tools.",
    "url": "https://proj.org",
    "category": "GIS & Mapping",
    "os": ["windows", "macos", "linux"],
    "pricing": "free",
    "tags": ["projections", "coordinate-transformation", "geodetic", "open-source", "osgeo"],
    "source": "https://github.com/OSGeo/PROJ",
    "language": "cpp"
  },
  {
    "id": "shapely",
    "name": "Shapely",
    "description": "Python library for manipulation and analysis of planar geometric objects. Wraps the GEOS library with a Pythonic API.",
    "url": "https://shapely.readthedocs.io",
    "category": "GIS & Mapping",
    "os": ["windows", "macos", "linux"],
    "pricing": "free",
    "tags": ["python", "geometry", "geos", "open-source", "spatial-analysis"],
    "source": "https://github.com/shapely/shapely",
    "language": "python"
  },
  {
    "id": "geopandas",
    "name": "GeoPandas",
    "description": "Extends Pandas with geospatial operations. GeoDataFrames for spatial joins, overlays, and plotting with Shapely geometries.",
    "url": "https://geopandas.org",
    "category": "GIS & Mapping",
    "os": ["windows", "macos", "linux"],
    "pricing": "free",
    "tags": ["python", "pandas", "geospatial", "open-source", "dataframes"],
    "source": "https://github.com/geopandas/geopandas",
    "language": "python"
  },
  {
    "id": "turfjs",
    "name": "Turf.js",
    "description": "Modular geospatial analysis engine for JavaScript and TypeScript. Runs in the browser or Node.js with GeoJSON in/out.",
    "url": "https://turfjs.org",
    "category": "GIS & Mapping",
    "os": ["web"],
    "pricing": "free",
    "tags": ["javascript", "geospatial", "geojson", "open-source", "browser"],
    "source": "https://github.com/Turfjs/turf",
    "language": "typescript"
  },
  {
    "id": "postgis",
    "name": "PostGIS",
    "description": "Spatial database extension for PostgreSQL. Adds geometry types, spatial indexing, and hundreds of geospatial functions.",
    "url": "https://postgis.net",
    "category": "GIS & Mapping",
    "os": ["windows", "macos", "linux"],
    "pricing": "free",
    "tags": ["postgresql", "spatial-database", "sql", "open-source", "osgeo"],
    "source": "https://github.com/postgis/postgis",
    "language": "c"
  },
  {
    "id": "h3",
    "name": "H3",
    "description": "Hexagonal hierarchical geospatial indexing system by Uber. Partition the globe into hexagons at 16 resolutions for spatial analysis.",
    "url": "https://h3geo.org",
    "category": "GIS & Mapping",
    "os": ["windows", "macos", "linux", "web"],
    "pricing": "free",
    "tags": ["hexagonal-grid", "spatial-index", "uber", "open-source", "geospatial"],
    "source": "https://github.com/uber/h3",
    "language": "c"
  },
  {
    "id": "leaflet",
    "name": "Leaflet",
    "description": "Lightweight JavaScript library for mobile-friendly interactive maps. 42 KB, extensible with hundreds of plugins.",
    "url": "https://leafletjs.com",
    "category": "GIS & Mapping",
    "os": ["web"],
    "pricing": "free",
    "tags": ["javascript", "web-mapping", "interactive", "open-source", "lightweight"],
    "source": "https://github.com/Leaflet/Leaflet",
    "language": "javascript"
  },
  {
    "id": "mapbox-gl-js",
    "name": "Mapbox GL JS",
    "description": "JavaScript library for interactive, customizable vector maps. WebGL-powered with 60 FPS rendering on desktop and mobile.",
    "url": "https://www.mapbox.com/mapbox-gljs",
    "category": "GIS & Mapping",
    "os": ["web"],
    "pricing": "freemium",
    "tags": ["javascript", "vector-maps", "webgl", "mapbox", "interactive"],
    "source": "https://github.com/mapbox/mapbox-gl-js",
    "language": "javascript"
  },
  {
    "id": "openlayers",
    "name": "OpenLayers",
    "description": "High-performance web mapping library. Renders tiles, vector data, and markers from GeoJSON, KML, GML, and other formats.",
    "url": "https://openlayers.org",
    "category": "GIS & Mapping",
    "os": ["web"],
    "pricing": "free",
    "tags": ["javascript", "web-mapping", "tiles", "open-source", "ogc"],
    "source": "https://github.com/openlayers/openlayers",
    "language": "javascript"
  },
  {
    "id": "cesiumjs",
    "name": "CesiumJS",
    "description": "Open-source JavaScript library for 3D globes and maps. WebGL-accelerated with terrain, imagery, and 3D Tiles support.",
    "url": "https://cesium.com/platform/cesiumjs",
    "category": "GIS & Mapping",
    "os": ["web"],
    "pricing": "free",
    "tags": ["3d-globe", "webgl", "3d-tiles", "open-source", "geospatial"],
    "source": "https://github.com/CesiumGS/cesium",
    "language": "javascript"
  },
  {
    "id": "deck-gl",
    "name": "deck.gl",
    "description": "WebGL-powered framework for large-scale data visualization on maps. Renders millions of data points with GPU acceleration.",
    "url": "https://deck.gl",
    "category": "GIS & Mapping",
    "os": ["web"],
    "pricing": "free",
    "tags": ["webgl", "data-visualization", "large-scale", "open-source", "uber"],
    "source": "https://github.com/visgl/deck.gl",
    "language": "javascript"
  },
  {
    "id": "kepler-gl",
    "name": "Kepler.gl",
    "description": "Browser-based geospatial analysis tool for large datasets by Uber. Drop in CSV or GeoJSON for instant map visualizations.",
    "url": "https://kepler.gl",
    "category": "GIS & Mapping",
    "os": ["web"],
    "pricing": "free",
    "tags": ["data-visualization", "geospatial", "uber", "open-source", "no-code"],
    "source": "https://github.com/keplergl/kepler.gl",
    "language": "javascript"
  }
]
